41006018,"For John said unto Herod, It is not lawful for thee to have thy brother’s wife."
41006019,"And Herodias set herself against him, and desired to kill him; and she could not;"
41006020,"for Herod feared John, knowing that he was a righteous man and a holy, and kept him safe. And when he heard him, he was much perplexed; and he heard him gladly."
41006021,"And when a convenient day was come, that Herod on his birthday made a supper to his lords, and the high captains, and the chief men of Galilee;"
41006022,"and when the daughter of Herodias herself came in and danced, she pleased Herod and them that sat at meat with him; and the king said unto the damsel, Ask of me whatsoever thou wilt, and I will give it thee."
41006023,"And he sware unto her, Whatsoever thou shalt ask of me, I will give it thee, unto the half of my kingdom."
41006024,"And she went out, and said unto her mother, What shall I ask? And she said, The head of John the Baptist."
41006025,"And she came in straightway with haste unto the king, and asked, saying, I will that thou forthwith give me in a charger the head of John the Baptist."
41006026,"And the king was exceeding sorry; but for the sake of his oaths, and of them that sat at meat, he would not reject her."
41006027,"And straightway the king sent forth a soldier of his guard, and commanded to bring his head: and he went and beheaded him in the prison,"
41006028,"and brought his head in a charger, and gave it to the damsel; and the damsel gave it to her mother."
41006029,"And when his disciples heard thereof, they came and took up his corpse, and laid it in a tomb."
41006030,"And the apostles gather themselves together unto Jesus; and they told him all things, whatsoever they had done, and whatsoever they had taught."
41006031,"And he saith unto them, Come ye yourselves apart into a desert place, and rest a while. For there were many coming and going, and they had no leisure so much as to eat."
41006032,And they went away in the boat to a desert place apart.
41006033,"And the people saw them going, and many knew them, and they ran there together on foot from all the cities, and outwent them."
41006034,"And he came forth and saw a great multitude, and he had compassion on them, because they were as sheep not having a shepherd: and he began to teach them many things."
41006035,"And when the day was now far spent, his disciples came unto him, and said, The place is desert, and the day is now far spent:"
41006036,"send them away, that they may go into the country and villages round about, and buy themselves somewhat to eat."
41006037,"But he answered and said unto them, Give ye them to eat. And they say unto him, Shall we go and buy two hundred pennyworth of bread, and give them to eat?"
41006038,"And he saith unto them, How many loaves have ye? go and see. And when they knew, they say, Five, and two fishes."
41006039,And he commanded them that all should sit down by companies upon the green grass.
41006040,"And they sat down in ranks, by hundreds, and by fifties."
41006041,"And he took the five loaves and the two fishes, and looking up to heaven, he blessed, and brake the loaves; and he gave to the disciples to set before them; and the two fishes divided he among them all."
41006042,"And they did all eat, and were filled."
41006043,"And they took up broken pieces, twelve basketfuls, and also of the fishes."
41006044,And they that ate the loaves were five thousand men.
41006045,"And straightway he constrained his disciples to enter into the boat, and to go before him unto the other side to Bethsaida, while he himself sendeth the multitude away."
41006046,"And after he had taken leave of them, he departed into the mountain to pray."
41006047,"And when even was come, the boat was in the midst of the sea, and he alone on the land."
41006048,"And seeing them distressed in rowing, for the wind was contrary unto them, about the fourth watch of the night he cometh unto them, walking on the sea; and he would have passed by them:"
41006049,"but they, when they saw him walking on the sea, supposed that it was an apparition, and cried out:"
41006050,"for they all saw him, and were troubled. But he straightway spake with them, and saith unto them, Be of good cheer: it is I; be not afraid."
41006051,And he went up unto them into the boat; and the wind ceased: and they were sore amazed in themselves;
41006052,"for they understood not concerning the loaves, but their heart was hardened."
41006053,"And when they had crossed over, they came to the land unto Gennesaret, and moored to the shore."
41006054,"And when they were come out of the boat, straightway the people knew him,"
41006055,"and ran round about that whole region, and began to carry about on their beds those that were sick, where they heard he was."
41006056,"And wheresoever he entered, into villages, or into cities, or into the country, they laid the sick in the marketplaces, and besought him that they might touch if it were but the border of his garment: and as many as touched him were made whole."
41007001,"And there are gathered together unto him the Pharisees, and certain of the scribes, which had come from Jerusalem,"
41007002,"and had seen that some of his disciples ate their bread with defiled, that is, unwashen, hands."
41007003,"For the Pharisees, and all the Jews, except they wash their hands diligently, eat not, holding the tradition of the elders:"
41007004,"and when they come from the marketplace, except they wash themselves, they eat not: and many other things there be, which they have received to hold, washings of cups, and pots, and brasen vessels."
41007005,"And the Pharisees and the scribes ask him, Why walk not thy disciples according to the tradition of the elders, but eat their bread with defiled hands?"
41007006,"And he said unto them, Well did Isaiah prophesy of you hypocrites, as it is written, This people honoureth me with their lips, But their heart is far from me."
41007007,"But in vain do they worship me, Teaching as their doctrines the precepts of men."
41007008,"Ye leave the commandment of God, and hold fast the tradition of men."
41007009,"And he said unto them, Full well do ye reject the commandment of God, that ye may keep your tradition."
41007010,"For Moses said, Honour thy father and thy mother; and, He that speaketh evil of father or mother, let him die the death:"
41007011,"but ye say, If a man shall say to his father or his mother, That wherewith thou mightest have been profited by me is Corban, that is to say, Given to God;"
41007012,ye no longer suffer him to do aught for his father or his mother;
41007013,"making void the word of God by your tradition, which ye have delivered: and many such like things ye do."
41007014,"And he called to him the multitude again, and said unto them, Hear me all of you, and understand:"
41007015,"there is nothing from without the man, that going into him can defile him: but the things which proceed out of the man are those that defile the man."
41007016,
41007017,"And when he was entered into the house from the multitude, his disciples asked of him the parable."
41007018,"And he saith unto them, Are ye so without understanding also? Perceive ye not, that whatsoever from without goeth into the man, it cannot defile him;"
41007019,"because it goeth not into his heart, but into his belly, and goeth out into the draught? This he said, making all meats clean."
41007020,"And he said, That which proceedeth out of the man, that defileth the man."
41007021,"For from within, out of the heart of men, evil thoughts proceed, fornications, thefts, murders, adulteries,"
41007022,"covetings, wickednesses, deceit, lasciviousness, an evil eye, railing, pride, foolishness:"
41007023,"all these evil things proceed from within, and defile the man."
41007024,"And from thence he arose, and went away into the borders of Tyre and Sidon. And he entered into a house, and would have no man know it: and he could not be hid."
41007025,"But straightway a woman, whose little daughter had an unclean spirit, having heard of him, came and fell down at his feet."
41007026,"Now the woman was a Greek, a Syrophoenician by race. And she besought him that he would cast forth the devil out of her daughter."
41007027,"And he said unto her, Let the children first be filled: for it is not meet to take the children’s bread and cast it to the dogs."
41007028,"But she answered and saith unto him, Yea, Lord: even the dogs under the table eat of the children’s crumbs."
41007029,"And he said unto her, For this saying go thy way; the devil is gone out of thy daughter."
41007030,"And she went away unto her house, and found the child laid upon the bed, and the devil gone out."
41007031,"And again he went out from the borders of Tyre, and came through Sidon unto the sea of Galilee, through the midst of the borders of Decapolis."
41007032,"And they bring unto him one that was deaf, and had an impediment in his speech; and they beseech him to lay his hand upon him."
41007033,"And he took him aside from the multitude privately, and put his fingers into his ears, and he spat, and touched his tongue;"
41007034,"and looking up to heaven, he sighed, and saith unto him, Ephphatha, that is, Be opened."
41007035,"And his ears were opened, and the bond of his tongue was loosed, and he spake plain."
41007036,"And he charged them that they should tell no man: but the more he charged them, so much the more a great deal they published it."
41007037,"And they were beyond measure astonished, saying, He hath done all things well: he maketh even the deaf to hear, and the dumb to speak."
41008001,"In those days, when there was again a great multitude, and they had nothing to eat, he called unto him his disciples, and saith unto them,"
41008002,"I have compassion on the multitude, because they continue with me now three days, and have nothing to eat:"
41008003,"and if I send them away fasting to their home, they will faint in the way; and some of them are come from far."
41008004,"And his disciples answered him, Whence shall one be able to fill these men with bread here in a desert place?"
41008005,"And he asked them, How many loaves have ye? And they said, Seven."
41008006,"And he commandeth the multitude to sit down on the ground: and he took the seven loaves, and having given thanks, he brake, and gave to his disciples, to set before them; and they set them before the multitude."
41008007,"And they had a few small fishes: and having blessed them, he commanded to set these also before them."
41008008,"And they did eat, and were filled: and they took up, of broken pieces that remained over, seven baskets."
41008009,And they were about four thousand: and he sent them away.
41008010,"And straightway he entered into the boat with his disciples, and came into the parts of Dalmanutha."
41008011,"And the Pharisees came forth, and began to question with him, seeking of him a sign from heaven, tempting him."
41008012,"And he sighed deeply in his spirit, and saith, Why doth this generation seek a sign? verily I say unto you, There shall no sign be given unto this generation."
41008013,"And he left them, and again entering into the boat departed to the other side."
41008014,And they forgot to take bread; and they had not in the boat with them more than one loaf.
41008015,"And he charged them, saying, Take heed, beware of the leaven of the Pharisees and the leaven of Herod."
41008016,"And they reasoned one with another, saying, We have no bread."
41008017,"And Jesus perceiving it saith unto them, Why reason ye, because ye have no bread? do ye not yet perceive, neither understand? have ye your heart hardened?"
41008018,"Having eyes, see ye not? and having ears, hear ye not? and do ye not remember?"
41008019,"When I brake the five loaves among the five thousand, how many baskets full of broken pieces took ye up? They say unto him, Twelve."
41008020,"And when the seven among the four thousand, how many basketfuls of broken pieces took ye up? And they say unto him, Seven."
41008021,"And he said unto them, Do ye not yet understand?"
41008022,"And they come unto Bethsaida. And they bring to him a blind man, and beseech him to touch him."
41008023,"And he took hold of the blind man by the hand, and brought him out of the village; and when he had spit on his eyes, and laid his hands upon him, he asked him, Seest thou aught?"
41008024,"And he looked up, and said, I see men; for I behold them as trees, walking."
41008025,"Then again he laid his hands upon his eyes; and he looked stedfastly, and was restored, and saw all things clearly."
41008026,"And he sent him away to his home, saying, Do not even enter into the village."
41008027,"And Jesus went forth, and his disciples, into the villages of Caesarea Philippi: and in the way he asked his disciples, saying unto them, Who do men say that I am?"
41008028,"And they told him, saying, John the Baptist: and others, Elijah; but others, One of the prophets."
41008029,"And he asked them, But who say ye that I am? Peter answereth and saith unto him, Thou art the Christ."
41008030,And he charged them that they should tell no man of him.
41008031,"And he began to teach them, that the Son of man must suffer many things, and be rejected by the elders, and the chief priests, and the scribes, and be killed, and after three days rise again."
41008032,"And he spake the saying openly. And Peter took him, and began to rebuke him."
41008033,"But he turning about, and seeing his disciples, rebuked Peter, and saith, Get thee behind me, Satan: for thou mindest not the things of God, but the things of men."
41008034,"And he called unto him the multitude with his disciples, and said unto them, If any man would come after me, let him deny himself, and take up his cross, and follow me."
41008035,For whosoever would save his life shall lose it; and whosoever shall lose his life for my sake and the gospel’s shall save it.
41008036,"For what doth it profit a man, to gain the whole world, and forfeit his life?"
41008037,For what should a man give in exchange for his life?
41008038,"For whosoever shall be ashamed of me and of my words in this adulterous and sinful generation, the Son of man also shall be ashamed of him, when he cometh in the glory of his Father with the holy angels."
41009001,"And he said unto them, Verily I say unto you, There be some here of them that stand by, which shall in no wise taste of death, till they see the kingdom of God come with power."
41009002,"And after six days Jesus taketh with him Peter, and James, and John, and bringeth them up into a high mountain apart by themselves: and he was transfigured before them:"
41009003,"and his garments became glistering, exceeding white; so as no fuller on earth can whiten them."
41009004,And there appeared unto them Elijah with Moses: and they were talking with Jesus.
41009005,"And Peter answereth and saith to Jesus, Rabbi, it is good for us to be here: and let us make three tabernacles; one for thee, and one for Moses, and one for Elijah."
41009006,For he wist not what to answer; for they became sore afraid.
41009007,"And there came a cloud overshadowing them: and there came a voice out of the cloud, This is my beloved Son: hear ye him."
41009008,"And suddenly looking round about, they saw no one any more, save Jesus only with themselves."
41009009,"And as they were coming down from the mountain, he charged them that they should tell no man what things they had seen, save when the Son of man should have risen again from the dead."
41009010,"And they kept the saying, questioning among themselves what the rising again from the dead should mean."
41009011,"And they asked him, saying, The scribes say that Elijah must first come."
41009012,"And he said unto them, Elijah indeed cometh first, and restoreth all things: and how is it written of the Son of man, that he should suffer many things and be set at nought?"
41009013,"But I say unto you, that Elijah is come, and they have also done unto him whatsoever they listed, even as it is written of him."
41009014,"And when they came to the disciples, they saw a great multitude about them, and scribes questioning with them."
41009015,"And straightway all the multitude, when they saw him, were greatly amazed, and running to him saluted him."
41009016,"And he asked them, What question ye with them?"
41009017,"And one of the multitude answered him, Master, I brought unto thee my son, which hath a dumb spirit;"
41009018,"and wheresoever it taketh him, it dasheth him down: and he foameth, and grindeth his teeth, and pineth away: and I spake to thy disciples that they should cast it out; and they were not able."
41009019,"And he answereth them and saith, O faithless generation, how long shall I be with you? how long shall I bear with you? bring him unto me."
41009020,"And they brought him unto him: and when he saw him, straightway the spirit tare him grievously; and he fell on the ground, and wallowed foaming."
41009021,"And he asked his father, How long time is it since this hath come unto him? And he said, From a child."
41009022,"And oft-times it hath cast him both into the fire and into the waters, to destroy him: but if thou canst do anything, have compassion on us, and help us."
41009023,"And Jesus said unto him, If thou canst! All things are possible to him that believeth."
41009024,"Straightway the father of the child cried out, and said, I believe; help thou mine unbelief."
41009025,"And when Jesus saw that a multitude came running together, he rebuked the unclean spirit, saying unto him, Thou dumb and deaf spirit, I command thee, come out of him, and enter no more into him."
41009026,"And having cried out, and torn him much, he came out: and the child became as one dead; insomuch that the more part said, He is dead."
41009027,"But Jesus took him by the hand, and raised him up; and he arose."
41009028,"And when he was come into the house, his disciples asked him privately, saying, We could not cast it out."
41009029,"And he said unto them, This kind can come out by nothing, save by prayer."
41009030,"And they went forth from thence, and passed through Galilee; and he would not that any man should know it."
41009031,"For he taught his disciples, and said unto them, The Son of man is delivered up into the hands of men, and they shall kill him; and when he is killed, after three days he shall rise again."
41009032,"But they understood not the saying, and were afraid to ask him."
41009033,"And they came to Capernaum: and when he was in the house he asked them, What were ye reasoning in the way?"
41009034,"But they held their peace: for they had disputed one with another in the way, who was the greatest."
41009035,"And he sat down, and called the twelve; and he saith unto them, If any man would be first, he shall be last of all, and minister of all."
41009036,"And he took a little child, and set him in the midst of them: and taking him in his arms, he said unto them,"
41009037,"Whosoever shall receive one of such little children in my name, receiveth me: and whosoever receiveth me, receiveth not me, but him that sent me."
41009038,"John said unto him, Master, we saw one casting out devils in thy name: and we forbade him, because he followed not us."
41009039,"But Jesus said, Forbid him not: for there is no man which shall do a mighty work in my name, and be able quickly to speak evil of me."
41009040,For he that is not against us is for us.
41009041,"For whosoever shall give you a cup of water to drink, because ye are Christ’s, verily I say unto you, he shall in no wise lose his reward."
41009042,"And whosoever shall cause one of these little ones that believe on me to stumble, it were better for him if a great millstone were hanged about his neck, and he were cast into the sea."
41009043,"And if thy hand cause thee to stumble, cut it off: it is good for thee to enter into life maimed, rather than having thy two hands to go into hell, into the unquenchable fire."
41009044,
41009045,"And if thy foot cause thee to stumble, cut it off: it is good for thee to enter into life halt, rather than having thy two feet to be cast into hell."
41009046,
41009047,"And if thine eye cause thee to stumble, cast it out: it is good for thee to enter into the kingdom of God with one eye, rather than having two eyes to be cast into hell;"
41009048,"where their worm dieth not, and the fire is not quenched."
41009049,For every one shall be salted with fire.
41009050,"Salt is good: but if the salt have lost its saltness, wherewith will ye season it? Have salt in yourselves, and be at peace one with another."
41010001,"And he arose from thence, and cometh into the borders of Judaea and beyond Jordan: and multitudes come together unto him again; and, as he was wont, he taught them again."
41010002,"And there came unto him Pharisees, and asked him, Is it lawful for a man to put away his wife? tempting him."
41010003,"And he answered and said unto them, What did Moses command you?"
41010004,"And they said, Moses suffered to write a bill of divorcement, and to put her away."
41010005,"But Jesus said unto them, For your hardness of heart he wrote you this commandment."
41010006,"But from the beginning of the creation, Male and female made he them."
41010007,"For this cause shall a man leave his father and mother, and shall cleave to his wife;"
41010008,"and the twain shall become one flesh: so that they are no more twain, but one flesh."
41010009,"What therefore God hath joined together, let not man put asunder."
41010010,And in the house the disciples asked him again of this matter.
41010011,"And he saith unto them, Whosoever shall put away his wife, and marry another, committeth adultery against her:"
41010012,"and if she herself shall put away her husband, and marry another, she committeth adultery."
41010013,"And they brought unto him little children, that he should touch them: and the disciples rebuked them."
41010014,"But when Jesus saw it, he was moved with indignation, and said unto them, Suffer the little children to come unto me; forbid them not: for of such is the kingdom of God."
41010015,"Verily I say unto you, Whosoever shall not receive the kingdom of God as a little child, he shall in no wise enter therein."
41010016,"And he took them in his arms, and blessed them, laying his hands upon them."
41010017,"And as he was going forth into the way, there ran one to him, and kneeled to him, and asked him, Good Master, what shall I do that I may inherit eternal life?"
41010018,"And Jesus said unto him, Why callest thou me good? none is good save one, even God."
41010019,"Thou knowest the commandments, Do not kill, Do not commit adultery, Do not steal, Do not bear false witness, Do not defraud, Honour thy father and mother."
41010020,"And he said unto him, Master, all these things have I observed from my youth."
41010021,"And Jesus looking upon him loved him, and said unto him, One thing thou lackest: go, sell whatsoever thou hast, and give to the poor, and thou shalt have treasure in heaven: and come, follow me."
41010022,"But his countenance fell at the saying, and he went away sorrowful: for he was one that had great possessions."
41010023,"And Jesus looked round about, and saith unto his disciples, How hardly shall they that have riches enter into the kingdom of God!"
41010024,"And the disciples were amazed at his words. But Jesus answereth again, and saith unto them, Children, how hard is it for them that trust in riches to enter into the kingdom of God!"
41010025,"It is easier for a camel to go through a needle’s eye, than for a rich man to enter into the kingdom of God."
41010026,"And they were astonished exceedingly, saying unto him, Then who can be saved?"
41010027,"Jesus looking upon them saith, With men it is impossible, but not with God: for all things are possible with God."
41010028,"Peter began to say unto him, Lo, we have left all, and have followed thee."
41010029,"Jesus said, Verily I say unto you, There is no man that hath left house, or brethren, or sisters, or mother, or father, or children, or lands, for my sake, and for the gospel’s sake,"
41010030,"but he shall receive a hundredfold now in this time, houses, and brethren, and sisters, and mothers, and children, and lands, with persecutions; and in the world to come eternal life."
41010031,But many that are first shall be last; and the last first.
41010032,"And they were in the way, going up to Jerusalem; and Jesus was going before them: and they were amazed; and they that followed were afraid. And he took again the twelve, and began to tell them the things that were to happen unto him,"
41010033,"saying, Behold, we go up to Jerusalem; and the Son of man shall be delivered unto the chief priests and the scribes; and they shall condemn him to death, and shall deliver him unto the Gentiles:"
41010034,"and they shall mock him, and shall spit upon him, and shall scourge him, and shall kill him; and after three days he shall rise again."
41010035,"And there come near unto him James and John, the sons of Zebedee, saying unto him, Master, we would that thou shouldest do for us whatsoever we shall ask of thee."
41010036,"And he said unto them, What would ye that I should do for you?"
41010037,"And they said unto him, Grant unto us that we may sit, one on thy right hand, and one on thy left hand, in thy glory."
41010038,"But Jesus said unto them, Ye know not what ye ask. Are ye able to drink the cup that I drink? or to be baptized with the baptism that I am baptized with?"
41010039,"And they said unto him, We are able. And Jesus said unto them, The cup that I drink ye shall drink; and with the baptism that I am baptized withal shall ye be baptized:"
41010040,but to sit on my right hand or on my left hand is not mine to give: but it is for them for whom it hath been prepared.
