41010041,"And when the ten heard it, they began to be moved with indignation concerning James and John."
41010042,"And Jesus called them to him, and saith unto them, Ye know that they which are accounted to rule over the Gentiles lord it over them; and their great ones exercise authority over them."
41010043,"But it is not so among you: but whosoever would become great among you, shall be your minister:"
41010044,"and whosoever would be first among you, shall be servant of all."
41010045,"For verily the Son of man came not to be ministered unto, but to minister, and to give his life a ransom for many."
41010046,"And they come to Jericho: and as he went out from Jericho, with his disciples and a great multitude, the son of Timaeus, Bartimaeus, a blind beggar, was sitting by the way side."
41010047,"And when he heard that it was Jesus of Nazareth, he began to cry out, and say, Jesus, thou son of David, have mercy on me."
41010048,"And many rebuked him, that he should hold his peace: but he cried out the more a great deal, Thou son of David, have mercy on me."
41010049,"And Jesus stood still, and said, Call ye him. And they call the blind man, saying unto him, Be of good cheer: rise, he calleth thee."
41010050,"And he, casting away his garment, sprang up, and came to Jesus."
41010051,"And Jesus answered him, and said, What wilt thou that I should do unto thee? And the blind man said unto him, Rabboni, that I may receive my sight."
41010052,"And Jesus said unto him, Go thy way; thy faith hath made thee whole. And straightway he received his sight, and followed him in the way."
41011001,"And when they draw nigh unto Jerusalem, unto Bethphage and Bethany, at the mount of Olives, he sendeth two of his disciples,"
41011002,"and saith unto them, Go your way into the village that is over against you: and straightway as ye enter into it, ye shall find a colt tied, whereon no man ever yet sat; loose him, and bring him."
41011003,"And if any one say unto you, Why do ye this? say ye, The Lord hath need of him; and straightway he will send him back hither."
41011004,"And they went away, and found a colt tied at the door without in the open street; and they loose him."
41011005,"And certain of them that stood there said unto them, What do ye, loosing the colt?"
41011006,And they said unto them even as Jesus had said: and they let them go.
41011007,"And they bring the colt unto Jesus, and cast on him their garments; and he sat upon him."
41011008,"And many spread their garments upon the way; and others branches, which they had cut from the fields."
41011009,"And they that went before, and they that followed, cried, Hosanna; Blessed is he that cometh in the name of the Lord:"
41011010,"Blessed is the kingdom that cometh, the kingdom of our father David: Hosanna in the highest."
41011011,"And he entered into Jerusalem, into the temple; and when he had looked round about upon all things, it being now eventide, he went out unto Bethany with the twelve."
41011012,"And on the morrow, when they were come out from Bethany, he hungered."
41011013,"And seeing a fig tree afar off having leaves, he came, if haply he might find anything thereon: and when he came to it, he found nothing but leaves; for it was not the season of figs."
41011014,"And he answered and said unto it, No man eat fruit from thee henceforward for ever. And his disciples heard it."
41011015,"And they come to Jerusalem: and he entered into the temple, and began to cast out them that sold and them that bought in the temple, and overthrew the tables of the money-changers, and the seats of them that sold the doves;"
41011016,and he would not suffer that any man should carry a vessel through the temple.
41011017,"And he taught, and said unto them, Is it not written, My house shall be called a house of prayer for all the nations? but ye have made it a den of robbers."
41011018,"And the chief priests and the scribes heard it, and sought how they might destroy him: for they feared him, for all the multitude was astonished at his teaching."
41011019,And every evening he went forth out of the city.
41011020,"And as they passed by in the morning, they saw the fig tree withered away from the roots."
41011021,"And Peter calling to remembrance saith unto him, Rabbi, behold, the fig tree which thou cursedst is withered away."
41011022,"And Jesus answering saith unto them, Have faith in God."
41011023,"Verily I say unto you, Whosoever shall say unto this mountain, Be thou taken up and cast into the sea; and shall not doubt in his heart, but shall believe that what he saith cometh to pass; he shall have it."
41011024,"Therefore I say unto you, All things whatsoever ye pray and ask for, believe that ye have received them, and ye shall have them."
41011025,"And whensoever ye stand praying, forgive, if ye have aught against any one; that your Father also which is in heaven may forgive you your trespasses."
41011026,
41011027,"And they come again to Jerusalem: and as he was walking in the temple, there come to him the chief priests, and the scribes, and the elders;"
41011028,"and they said unto him, By what authority doest thou these things? or who gave thee this authority to do these things?"
41011029,"And Jesus said unto them, I will ask of you one question, and answer me, and I will tell you by what authority I do these things."
41011030,"The baptism of John, was it from heaven, or from men? answer me."
41011031,"And they reasoned with themselves, saying, If we shall say, From heaven; he will say, Why then did ye not believe him?"
41011032,"But should we say, From men—they feared the people: for all verily held John to be a prophet."
41011033,"And they answered Jesus and say, We know not. And Jesus saith unto them, Neither tell I you by what authority I do these things."
41012001,"And he began to speak unto them in parables. A man planted a vineyard, and set a hedge about it, and digged a pit for the winepress, and built a tower, and let it out to husbandmen, and went into another country."
41012002,"And at the season he sent to the husbandmen a servant, that he might receive from the husbandmen of the fruits of the vineyard."
41012003,"And they took him, and beat him, and sent him away empty."
41012004,"And again he sent unto them another servant; and him they wounded in the head, and handled shamefully."
41012005,"And he sent another; and him they killed: and many others; beating some, and killing some."
41012006,"He had yet one, a beloved son: he sent him last unto them, saying, They will reverence my son."
41012007,"But those husbandmen said among themselves, This is the heir; come, let us kill him, and the inheritance shall be ours."
41012008,"And they took him, and killed him, and cast him forth out of the vineyard."
41012009,"What therefore will the lord of the vineyard do? he will come and destroy the husbandmen, and will give the vineyard unto others."
41012010,"Have ye not read even this scripture; The stone which the builders rejected, The same was made the head of the corner:"
41012011,"This was from the Lord, And it is marvelous in our eyes?"
41012012,"And they sought to lay hold on him; and they feared the multitude; for they perceived that he spake the parable against them: and they left him, and went away."
41012013,"And they send unto him certain of the Pharisees and of the Herodians, that they might catch him in talk."
41012014,"And when they were come, they say unto him, Master, we know that thou art true, and carest not for any one: for thou regardest not the person of men, but of a truth teachest the way of God: Is it lawful to give tribute unto Caesar, or not?"
41012015,"Shall we give, or shall we not give? But he, knowing their hypocrisy, said unto them, Why tempt ye me? bring me a penny, that I may see it."
41012016,"And they brought it. And he saith unto them, Whose is this image and superscription? And they said unto him, Caesar’s."
41012017,"And Jesus said unto them, Render unto Caesar the things that are Caesar’s, and unto God the things that are God’s. And they marveled greatly at him."
41012018,"And there come unto him Sadducees, which say that there is no resurrection; and they asked him, saying,"
41012019,"Master, Moses wrote unto us, If a man’s brother die, and leave a wife behind him, and leave no child, that his brother should take his wife, and raise up seed unto his brother."
41012020,"There were seven brethren: and the first took a wife, and dying left no seed;"
41012021,"and the second took her, and died, leaving no seed behind him; and the third likewise:"
41012022,and the seven left no seed. Last of all the woman also died.
41012023,In the resurrection whose wife shall she be of them? for the seven had her to wife.
41012024,"Jesus said unto them, Is it not for this cause that ye err, that ye know not the scriptures, nor the power of God?"
41012025,"For when they shall rise from the dead, they neither marry, nor are given in marriage; but are as angels in heaven."
41012026,"But as touching the dead, that they are raised; have ye not read in the book of Moses, in the place concerning the Bush, how God spake unto him, saying, I am the God of Abraham, and the God of Isaac, and the God of Jacob?"
41012027,"He is not the God of the dead, but of the living: ye do greatly err."
41012028,"And one of the scribes came, and heard them questioning together, and knowing that he had answered them well, asked him, What commandment is the first of all?"
41012029,"Jesus answered, The first is, Hear, O Israel; The Lord our God, the Lord is one:"
41012030,"and thou shalt love the Lord thy God with all thy heart, and with all thy soul, and with all thy mind, and with all thy strength."
41012031,"The second is this, Thou shalt love thy neighbour as thyself. There is none other commandment greater than these."
41012032,"And the scribe said unto him, Of a truth, Master, thou hast well said that he is one; and there is none other but he:"
41012033,"and to love him with all the heart, and with all the understanding, and with all the strength, and to love his neighbour as himself, is much more than all whole burnt offerings and sacrifices."
41012034,"And when Jesus saw that he answered discreetly, he said unto him, Thou art not far from the kingdom of God. And no man after that durst ask him any question."
41012035,"And Jesus answered and said, as he taught in the temple, How say the scribes that the Christ is the son of David?"
41012036,"David himself said in the Holy Spirit, The Lord said unto my Lord, Sit thou on my right hand, Till I make thine enemies the footstool of thy feet."
41012037,David himself calleth him Lord; and whence is he his son? And the common people heard him gladly.
41012038,"And in his teaching he said, Beware of the scribes, which desire to walk in long robes, and to have salutations in the marketplaces,"
41012039,"and chief seats in the synagogues, and chief places at feasts:"
41012040,"they which devour widows’ houses, and for a pretence make long prayers; these shall receive greater condemnation."
41012041,"And he sat down over against the treasury, and beheld how the multitude cast money into the treasury: and many that were rich cast in much."
41012042,"And there came a poor widow, and she cast in two mites, which make a farthing."
41012043,"And he called unto him his disciples, and said unto them, Verily I say unto you, This poor widow cast in more than all they which are casting into the treasury:"
41012044,"for they all did cast in of their superfluity; but she of her want did cast in all that she had, even all her living."
41013001,"And as he went forth out of the temple, one of his disciples saith unto him, Master, behold, what manner of stones and what manner of buildings!"
41013002,"And Jesus said unto him, Seest thou these great buildings? there shall not be left here one stone upon another, which shall not be thrown down."
41013003,"And as he sat on the mount of Olives over against the temple, Peter and James and John and Andrew asked him privately,"
41013004,"Tell us, when shall these things be? and what shall be the sign when these things are all about to be accomplished?"
41013005,"And Jesus began to say unto them, Take heed that no man lead you astray."
41013006,"Many shall come in my name, saying, I am he; and shall lead many astray."
41013007,"And when ye shall hear of wars and rumours of wars, be not troubled: these things must needs come to pass; but the end is not yet."
41013008,"For nation shall rise against nation, and kingdom against kingdom: there shall be earthquakes in divers places; there shall be famines: these things are the beginning of travail."
41013009,"But take ye heed to yourselves: for they shall deliver you up to councils; and in synagogues shall ye be beaten; and before governors and kings shall ye stand for my sake, for a testimony unto them."
41013010,And the gospel must first be preached unto all the nations.
41013011,"And when they lead you to judgment, and deliver you up, be not anxious beforehand what ye shall speak: but whatsoever shall be given you in that hour, that speak ye: for it is not ye that speak, but the Holy Ghost."
41013012,"And brother shall deliver up brother to death, and the father his child; and children shall rise up against parents, and cause them to be put to death."
41013013,"And ye shall be hated of all men for my name’s sake: but he that endureth to the end, the same shall be saved."
41013014,"But when ye see the abomination of desolation standing where he ought not (let him that readeth understand), then let them that are in Judaea flee unto the mountains:"
41013015,"and let him that is on the housetop not go down, nor enter in, to take anything out of his house:"
41013016,and let him that is in the field not return back to take his cloke.
41013017,But woe unto them that are with child and to them that give suck in those days!
41013018,And pray ye that it be not in the winter.
41013019,"For those days shall be tribulation, such as there hath not been the like from the beginning of the creation which God created until now, and never shall be."
41013020,"And except the Lord had shortened the days, no flesh would have been saved: but for the elect’s sake, whom he chose, he shortened the days."
41013021,"And then if any man shall say unto you, Lo, here is the Christ; or, Lo, there; believe it not:"
41013022,"for there shall arise false Christs and false prophets, and shall shew signs and wonders, that they may lead astray, if possible, the elect."
41013023,"But take ye heed: behold, I have told you all things beforehand."
41013024,"But in those days, after that tribulation, the sun shall be darkened, and the moon shall not give her light,"
41013025,"and the stars shall be falling from heaven, and the powers that are in the heavens shall be shaken."
41013026,And then shall they see the Son of man coming in clouds with great power and glory.
41013027,"And then shall he send forth the angels, and shall gather together his elect from the four winds, from the uttermost part of the earth to the uttermost part of heaven."
41013028,"Now from the fig tree learn her parable: when her branch is now become tender, and putteth forth its leaves, ye know that the summer is nigh;"
41013029,"even so ye also, when ye see these things coming to pass, know ye that he is nigh, even at the doors."
41013030,"Verily I say unto you, This generation shall not pass away, until all these things be accomplished."
41013031,Heaven and earth shall pass away: but my words shall not pass away.
41013032,"But of that day or that hour knoweth no one, not even the angels in heaven, neither the Son, but the Father."
41013033,"Take ye heed, watch and pray: for ye know not when the time is."
41013034,"It is as when a man, sojourning in another country, having left his house, and given authority to his servants, to each one his work, commanded also the porter to watch."
41013035,"Watch therefore: for ye know not when the lord of the house cometh, whether at even, or at midnight, or at cockcrowing, or in the morning;"
41013036,lest coming suddenly he find you sleeping.
41013037,"And what I say unto you I say unto all, Watch."
41014001,"Now after two days was the feast of the passover and the unleavened bread: and the chief priests and the scribes sought how they might take him with subtilty, and kill him:"
41014002,"for they said, Not during the feast, lest haply there shall be a tumult of the people."
41014003,"And while he was in Bethany in the house of Simon the leper, as he sat at meat, there came a woman having an alabaster cruse of ointment of spikenard very costly; and she brake the cruse, and poured it over his head."
41014004,"But there were some that had indignation among themselves, saying, To what purpose hath this waste of the ointment been made?"
41014005,"For this ointment might have been sold for above three hundred pence, and given to the poor. And they murmured against her."
41014006,"But Jesus said, Let her alone; why trouble ye her? she hath wrought a good work on me."
41014007,"For ye have the poor always with you, and whensoever ye will ye can do them good: but me ye have not always."
41014008,She hath done what she could: she hath anointed my body aforehand for the burying.
41014009,"And verily I say unto you, Wheresoever the gospel shall be preached throughout the whole world, that also which this woman hath done shall be spoken of for a memorial of her."
41014010,"And Judas Iscariot, he that was one of the twelve, went away unto the chief priests, that he might deliver him unto them."
41014011,"And they, when they heard it, were glad, and promised to give him money. And he sought how he might conveniently deliver him unto them."
41014012,"And on the first day of unleavened bread, when they sacrificed the passover, his disciples say unto him, Where wilt thou that we go and make ready that thou mayest eat the passover?"
41014013,"And he sendeth two of his disciples, and saith unto them, Go into the city, and there shall meet you a man bearing a pitcher of water: follow him;"
41014014,"and wheresoever he shall enter in, say to the goodman of the house, The Master saith, Where is my guest-chamber, where I shall eat the passover with my disciples?"
41014015,And he will himself shew you a large upper room furnished and ready: and there make ready for us.
41014016,"And the disciples went forth, and came into the city, and found as he had said unto them: and they made ready the passover."
41014017,And when it was evening he cometh with the twelve.
41014018,"And as they sat and were eating, Jesus said, Verily I say unto you, One of you shall betray me, even he that eateth with me."
41014019,"They began to be sorrowful, and to say unto him one by one, Is it I?"
41014020,"And he said unto them, It is one of the twelve, he that dippeth with me in the dish."
41014021,"For the Son of man goeth, even as it is written of him: but woe unto that man through whom the Son of man is betrayed! good were it for that man if he had not been born."
41014022,"And as they were eating, he took bread, and when he had blessed, he brake it, and gave to them, and said, Take ye: this is my body."
41014023,"And he took a cup, and when he had given thanks, he gave to them: and they all drank of it."
41014024,"And he said unto them, This is my blood of the covenant, which is shed for many."
41014025,"Verily I say unto you, I will no more drink of the fruit of the vine, until that day when I drink it new in the kingdom of God."
41014026,"And when they had sung a hymn, they went out unto the mount of Olives."
41014027,"And Jesus saith unto them, All ye shall be offended: for it is written, I will smite the shepherd, and the sheep shall be scattered abroad."
41014028,"Howbeit, after I am raised up, I will go before you into Galilee."
41014029,"But Peter said unto him, Although all shall be offended, yet will not I."
41014030,"And Jesus saith unto him, Verily I say unto thee, that thou today, even this night, before the cock crow twice, shalt deny me thrice."
41014031,"But he spake exceeding vehemently, If I must die with thee, I will not deny thee. And in like manner also said they all."
41014032,"And they come unto a place which was named Gethsemane: and he saith unto his disciples, Sit ye here, while I pray."
41014033,"And he taketh with him Peter and James and John, and began to be greatly amazed, and sore troubled."
41014034,"And he saith unto them, My soul is exceeding sorrowful even unto death: abide ye here, and watch."
41014035,"And he went forward a little, and fell on the ground, and prayed that, if it were possible, the hour might pass away from him."
41014036,"And he said, Abba, Father, all things are possible unto thee; remove this cup from me: howbeit not what I will, but what thou wilt."
41014037,"And he cometh, and findeth them sleeping, and saith unto Peter, Simon, sleepest thou? couldest thou not watch one hour?"
41014038,"Watch and pray, that ye enter not into temptation: the spirit indeed is willing, but the flesh is weak."
41014039,"And again he went away, and prayed, saying the same words."
41014040,"And again he came, and found them sleeping, for their eyes were very heavy; and they wist not what to answer him."
41014041,"And he cometh the third time, and saith unto them, Sleep on now, and take your rest: it is enough; the hour is come; behold, the Son of man is betrayed into the hands of sinners."
41014042,"Arise, let us be going: behold, he that betrayeth me is at hand."
41014043,"And straightway, while he yet spake, cometh Judas, one of the twelve, and with him a multitude with swords and staves, from the chief priests and the scribes and the elders."
41014044,"Now he that betrayed him had given them a token, saying, Whomsoever I shall kiss, that is he; take him, and lead him away safely."
41014045,"And when he was come, straightway he came to him, and saith, Rabbi; and kissed him."
41014046,"And they laid hands on him, and took him."
41014047,"But a certain one of them that stood by drew his sword, and smote the servant of the high priest, and struck off his ear."
41014048,"And Jesus answered and said unto them, Are ye come out, as against a robber, with swords and staves to seize me?"
41014049,"I was daily with you in the temple teaching, and ye took me not: but this is done that the scriptures might be fulfilled."
41014050,"And they all left him, and fled."
41014051,"And a certain young man followed with him, having a linen cloth cast about him, over his naked body: and they lay hold on him;"
41014052,"but he left the linen cloth, and fled naked."
41014053,And they led Jesus away to the high priest: and there come together with him all the chief priests and the elders and the scribes.
41014054,"And Peter had followed him afar off, even within, into the court of the high priest; and he was sitting with the officers, and warming himself in the light of the fire."
41014055,Now the chief priests and the whole council sought witness against Jesus to put him to death; and found it not.
41014056,"For many bare false witness against him, and their witness agreed not together."
41014057,"And there stood up certain, and bare false witness against him, saying,"
41014058,"We heard him say, I will destroy this temple that is made with hands, and in three days I will build another made without hands."
41014059,And not even so did their witness agree together.
41014060,"And the high priest stood up in the midst, and asked Jesus, saying, Answerest thou nothing? what is it which these witness against thee?"
41014061,"But he held his peace, and answered nothing. Again the high priest asked him, and saith unto him, Art thou the Christ, the Son of the Blessed?"
41014062,"And Jesus said, I am: and ye shall see the Son of man sitting at the right hand of power, and coming with the clouds of heaven."
41014063,"And the high priest rent his clothes, and saith, What further need have we of witnesses?"
41014064,Ye have heard the blasphemy: what think ye? And they all condemned him to be worthy of death.
41014065,"And some began to spit on him, and to cover his face, and to buffet him, and to say unto him, Prophesy: and the officers received him with blows of their hands."
41014066,"And as Peter was beneath in the court, there cometh one of the maids of the high priest;"
41014067,"and seeing Peter warming himself, she looked upon him, and saith, Thou also wast with the Nazarene, even Jesus."
41014068,"But he denied, saying, I neither know, nor understand what thou sayest: and he went out into the porch; and the cock crew."
41014069,"And the maid saw him, and began again to say to them that stood by, This is one of them."
41014070,"But he again denied it. And after a little while again they that stood by said to Peter, Of a truth thou art one of them; for thou art a Galilaean."
41014071,"But he began to curse, and to swear, I know not this man of whom ye speak."
41014072,"And straightway the second time the cock crew. And Peter called to mind the word, how that Jesus said unto him, Before the cock crow twice, thou shalt deny me thrice. And when he thought thereon, he wept."
41015001,"And straightway in the morning the chief priests with the elders and scribes, and the whole council, held a consultation, and bound Jesus, and carried him away, and delivered him up to Pilate."
41015002,"And Pilate asked him, Art thou the King of the Jews? And he answering saith unto him, Thou sayest."
41015003,And the chief priests accused him of many things.
41015004,"And Pilate again asked him, saying, Answerest thou nothing? behold how many things they accuse thee of."
41015005,But Jesus no more answered anything; insomuch that Pilate marveled.
41015006,"Now at the feast he used to release unto them one prisoner, whom they asked of him."
